{
  "description": "Empty and absent typed predicates both declare no semantic edge",
  "id": "okf-83a160c2-9a5b-4df9-87b4-40ac8f59ac89",
  "resource": "templates/okf/OKF-STANDARD.md",
  "status": "active",
  "supersedes": [],
  "tags": [
    "fixture",
    "okf"
  ],
  "timestamp": "2026-08-08T00:00:00Z",
  "title": "Empty relationship fixture",
  "type": "Decision"
}
