{
  "assertion_state": "historical",
  "branch": "main",
  "capture_tier": "session",
  "commit_sha": [
    "0123456789abcdef0123456789abcdef01234567",
    "fedcba9876543210fedcba9876543210fedcba98"
  ],
  "description": "Session capture fixture",
  "epic_refs": [
    26
  ],
  "evidence_refs": [
    "git:0123456789abcdef0123456789abcdef01234567",
    "git:fedcba9876543210fedcba9876543210fedcba98"
  ],
  "generated_at": "2026-08-06T04:10:00Z",
  "generated_by": "end-session",
  "session_id": "019fd470-7afa-4023-bdbd-0d971652dacf",
  "source_authority": "repository-git",
  "source_repository": "self",
  "tags": [
    "fixture",
    "okf",
    "session"
  ],
  "timestamp": "2026-08-06T04:10:00Z",
  "title": "Fixture session synthesis",
  "type": "Inbox"
}
