{
  "assertion_state": "historical",
  "branch": "main",
  "capture_tier": "commit",
  "commit_sha": "0123456789abcdef0123456789abcdef0123456789abcdef0123456789abcdef",
  "description": "Commit capture fixture with a full SHA-256 object identifier",
  "evidence_refs": [
    "git:0123456789abcdef0123456789abcdef0123456789abcdef0123456789abcdef"
  ],
  "generated_at": "2026-08-06T04:10:00Z",
  "generated_by": "okf-post-commit",
  "issue_refs": [
    26
  ],
  "source_authority": "repository-git",
  "source_repository": "self",
  "tags": [
    "fixture",
    "okf",
    "sha256"
  ],
  "timestamp": "2026-08-06T04:10:00Z",
  "title": "Fixture SHA-256 commit capture",
  "type": "Inbox"
}
